{
  "$schema": "https://json-schema.org/draft/2020-12/schema",
  "$id": "https://solar.local/schemas/evidence/claim_verdict.v1.schema.json",
  "title": "Solar Evidence ABI - Claim Verdict",
  "type": "object",
  "required": ["schema", "task_id", "sprint_id", "node_id", "status", "inputs", "outputs", "artifacts", "provenance", "limitations"],
  "additionalProperties": false,
  "properties": {
    "schema": {"const": "claim_verdict.v1"},
    "task_id": {"type": "string", "minLength": 1},
    "sprint_id": {"type": "string", "minLength": 1},
    "node_id": {"type": "string", "minLength": 1},
    "status": {"$ref": "#/$defs/status"},
    "inputs": {"type": "object", "additionalProperties": true},
    "outputs": {
      "type": "object",
      "required": ["verdicts"],
      "additionalProperties": true,
      "properties": {
        "verdicts": {"type": "array", "items": {"$ref": "#/$defs/verdict"}}
      }
    },
    "artifacts": {"type": "array", "items": {"$ref": "#/$defs/artifact"}},
    "provenance": {"$ref": "#/$defs/provenance"},
    "limitations": {"type": "array", "items": {"type": "string"}}
  },
  "$defs": {
    "status": {"type": "string", "enum": ["completed", "failed", "inconclusive"]},
    "artifact": {
      "type": "object",
      "required": ["type", "path"],
      "additionalProperties": false,
      "properties": {
        "type": {"type": "string", "minLength": 1},
        "path": {"type": "string", "minLength": 1},
        "sha256": {"type": "string", "pattern": "^[A-Fa-f0-9]{64}$"}
      }
    },
    "provenance": {
      "type": "object",
      "required": ["operator_id", "implementation_package", "timestamp"],
      "additionalProperties": true,
      "properties": {
        "operator_id": {"type": "string", "minLength": 1},
        "implementation_package": {"type": "string", "minLength": 1},
        "timestamp": {"type": "string", "format": "date-time"}
      }
    },
    "verdict": {
      "type": "object",
      "required": ["claim_id", "verdict", "confidence", "basis", "evidence_ids"],
      "additionalProperties": true,
      "properties": {
        "claim_id": {"type": "string", "minLength": 1},
        "verdict": {"type": "string", "enum": ["supported", "partially_supported", "refuted", "inconclusive", "not_testable", "blocked"]},
        "confidence": {"type": "number", "minimum": 0, "maximum": 1},
        "basis": {"type": "string", "minLength": 1},
        "evidence_ids": {"type": "array", "items": {"type": "string", "minLength": 1}},
        "limitations": {"type": "array", "items": {"type": "string"}}
      }
    }
  }
}
