{
  "artifacts": [
    {
      "path": "artifacts/autosci/runs/paper-draft-8035ae7f7a/claim_verdict.json",
      "type": "solar_evidence_json"
    }
  ],
  "inputs": {
    "claim_id": "claim-001",
    "claims_evidence": "artifacts/autosci/runs/paper-draft-8035ae7f7a/research_claims.json",
    "code_evidence": "artifacts/autosci/runs/paper-draft-8035ae7f7a/code_evidence_map.json",
    "experiment_result_evidence": "artifacts/autosci/runs/paper-draft-8035ae7f7a/experiment_result.json"
  },
  "limitations": [
    "Fixture verdict is derived only from supplied local evidence; it is not external scientific validation."
  ],
  "node_id": "node-verify-claim",
  "outputs": {
    "verdicts": [
      {
        "basis": "Verdict derived from experiment_result.v1 outcome `supports` for `exp-001`. Claim text: This compact markdown fixture is derived from the SkillGen paper for Solar-native AutoSci operator smoke testing.",
        "claim_evidence_ids": [
          "claim-001",
          "paper-skillgen-operator-smoke-paper",
          "skillgen_operator_smoke_paper.md#evidence-notes"
        ],
        "claim_id": "claim-001",
        "code_evidence_ids": [
          "task-autosci-skillgen-map_code_evidence",
          "map-001",
          "artifacts/autosci/runs/paper-draft-8035ae7f7a/sample_repo/bridge_fixture.py",
          "claim-001"
        ],
        "confidence": 0.72,
        "evidence_ids": [
          "claim-001",
          "paper-skillgen-operator-smoke-paper",
          "skillgen_operator_smoke_paper.md#evidence-notes",
          "task-autosci-skillgen-run_experiment",
          "exp-001",
          "evidence:autosci-fixture-result",
          "evidence:autosci-fixture-ledger",
          "task-autosci-skillgen-map_code_evidence",
          "map-001",
          "artifacts/autosci/runs/paper-draft-8035ae7f7a/sample_repo/bridge_fixture.py"
        ],
        "evidence_outcome": "supports",
        "experiment_evidence_ids": [
          "task-autosci-skillgen-run_experiment",
          "exp-001",
          "evidence:autosci-fixture-result",
          "evidence:autosci-fixture-ledger"
        ],
        "limitations": [
          "Fixture verdict is derived only from supplied local evidence; it is not external scientific validation."
        ],
        "verdict": "supported"
      }
    ]
  },
  "provenance": {
    "implementation_package": "plugins/autosci",
    "operator_id": "autosci-bridge",
    "timestamp": "2026-06-22T21:27:39Z"
  },
  "schema": "claim_verdict.v1",
  "sprint_id": "phase19-skillgen-operator-smoke",
  "status": "completed",
  "task_id": "task-autosci-skillgen-verify_claim"
}
